Organizations,slogan,tech,topic,website,descripton,link,ideas
PAL Robotics,Enhance people’s quality of life through Robotics,"python, javascript, c++","robotics, reinforcement learning, web tools",https://pal-robotics.com/,"Enhance people’s quality of life through Robotics
PAL Robotics is a European company that specializes in developing humanoid robots and autonomous systems for research, service, and industrial applications. The company was founded in 2004 by a group of robotics experts with the aim of creating innovative solutions that can enhance the quality of life for people and support industry transformation. PAL Robotics headquarter is in Barcelona, Spain, and has a team of more than 100 professionals with diverse backgrounds in robotics, artificial intelligence, mechanical engineering, and software development. The company is recognized for its advanced humanoid robots, such as REEM-C, TALOS, and Kangaroo; its retail and intralogistics solutions Stockbot, TIAGo base and TIAGo Base AI; its Social robot ARI and its mobile manipulators TIAGo and TIAGo Pro. All these platforms are designed to interact with humans in a natural way, perform complex tasks, and operate in dynamic environments.",https://pal-robotics.com/2025-google-summer-code-proposals/#tips-successful-gsoc,https://pal-robotics.com/2025-google-summer-code-proposals/#tips-successful-gsoc
PEcAn Project,Develop and promote tools for ecosystem modeling,"r, docker, api, geospatial","data science, ecosystem models, scientific visualization, climate science, Ecological Forecasting,",https://pecanproject.github.io/,"Develop and promote tools for ecosystem modeling
Climate change science has witnessed an explosion in the amount and types of data that can be brought to bear on the potential responses of the terrestrial carbon cycle and biodiversity to global change. Many of the most pressing questions about global change are not necessarily limited by the need to collect new data as much as by our ability to synthesize existing data. This project specifically seeks to improve this ability. Because no one measurement provides a complete picture, multiple data sources must be integrated in a sensible manner. Process-based models represent an ideal framework for integrating these data streams because they represent multiple processes at different spatial and temporal scales in ways that capture our current understanding of the causal connections across scales and among data types. Three components are required to bridge this gap between the available data and the required level of understanding: 1) a state-of-the-art ecosystem model, 2) a workflow management system to handle the numerous streams of data, and 3) a data assimilation statistical framework in order to synthesize the data with the model.",https://pecanproject.github.io/gsoc.html,https://pecanproject.github.io/gsoc_ideas/
Pharo Consortium,Modern and immersive programming language,"git, smalltalk, pharo, spec, SUnit","machine learning, programming languages, virtual machines, Modelling, Live music",https://pharo.org/,"Modern and immersive programming language
Pharo is a dynamic, purely object-oriented programming language (where everything is an object) that is inspired by Smalltalk. It also includes a powerful IDE that focuses on simplicity and quick feedback. Its entire syntax can fit on a postcard, and you can code directly in the debugger. Pharo has useful tools that help you work efficiently. The goal of Pharo is to provide a clean, innovative, free, and open-source environment. With a stable and small core system, great development tools, and regular updates, Pharo is a good choice for building and running important applications. Pharo supports a healthy community made up of both private and commercial contributors who help improve and maintain the core system and its external packages.",https://gsoc.pharo.org/,https://gsoc.pharo.org/ideas
Plone Foundation,"Python-based CMS, with React front-end.","python, javascript, react","web, cms",https://plone.org,"Python-based CMS, with React front-end.
Plone is a Python-based CMS built with workflow and security at the forefront. It is developed by a world-wide community and uses modern technologies and techniques. It comes with a complete API and a React-based frontend. Also home to Guillotina.io, a full stack data framework, and the Zope and ZODB object database.",https://plone.org,https://plone.org/community/gsoc/2025
PostgreSQL,The Most Advanced Open Source Relational Database,"c, python, postgresql, javascript, go","web, database, ui, sql, Benchmark",https://postgresql.org,"The Most Advanced Open Source Relational Database
PostgreSQL is a powerful, open source object-relational database system with over 30 years of active development that has earned it a strong reputation for reliability, feature robustness, and performance.",https://wiki.postgresql.org/wiki/GSoC,https://wiki.postgresql.org/wiki/GSoC_2025
Processing Foundation,To empower all people to learn to program,"javascript, java, typescript, webgl, GitHub Actions","education, web, graphics, creative coding, design",http://processingfoundation.org,"To empower all people to learn to program
Our mission is to promote software learning within the arts, artistic learning within technology-related fields, and to celebrate the diverse communities that make these fields vibrant, liberatory, and innovative. Our goal is to support people of all backgrounds in learning how to program and make creative work with code, especially those who might not otherwise have access to tools and resources. We also believe that some of the most radical futures and innovative technologies are being built by communities that have been pushed to the margins by dominant tech. We hope to support those who have been marginalized by technology in continued self-determination by providing time, space, and resources. We work toward our goals by developing and distributing a group of related software projects, which includes Processing (Java), p5.js (JavaScript), and p5.js Editor (JavaScript), and by facilitating partnerships and collaborations with allied organizations and individuals to build a more diverse community around software and the arts.",https://github.com/processing/Processing-Foundation-GSoC,https://github.com/processing/Processing-Foundation-GSoC/wiki/Project-Ideas-List-(GSoC-2025)
Project Mesa,Mesa: Agent-based modeling in Python 3+,"python, ui/ux, LLMs, Vector Operations","Agent Based Models, Generative Science",https://mesa.readthedocs.io/en/latest/,"Mesa: Agent-based modeling in Python 3+
Mesa is an Apache2 licensed agent-based modeling (or ABM) framework in Python. It allows users to quickly create agent-based models using built-in core components (such as spatial grids and agent schedulers) or customized implementations; visualize them using a browser-based interface; and analyze their results using Python’s data analysis tools. Its goal is to provide an ecosystem to support generative science approaches, improve understanding of complex systems and aid practical decision-making.",https://github.com/projectmesa/mesa/blob/main/CONTRIBUTING.md,https://github.com/projectmesa/mesa/wiki/Google-Summer-of-Code-2025
Prometheus-Operator,Managing Prometheus atop Kubernetes,"prometheus, go, kubernetes, kubernetes operators","monitoring, cloud, observability, Kubernetes Operator",https://prometheus-operator.dev/,"The Prometheus Operator provides Kubernetes native deployment and management of Prometheus and related monitoring components. The purpose of this project is to simplify and automate the configuration of a Prometheus based monitoring stack for Kubernetes clusters. The Prometheus operator includes, but is not limited to, the following features: * Kubernetes Custom Resources: Use Kubernetes custom resources to deploy and manage Prometheus, Alertmanager, and related components. * Simplified Deployment Configuration: Configure the fundamentals of Prometheus like versions, persistence, retention policies, and replicas from a native Kubernetes resource. * Prometheus Target Configuration: Automatically generate monitoring target configurations based on familiar Kubernetes label queries; no need to learn a Prometheus specific configuration language.",https://prometheus-operator.dev/,https://github.com/prometheus-operator/community/blob/main/mentoring/gsoc/2025/project_ideas.md
Python Software Foundation,A programming language used for science & more,"python, javascript","security, visualization, compiler, modeling, Backup",https://python-gsoc.org/,"Python is a programming language that lets you work more quickly and integrate your systems more effectively. The Python Software Foundation serves as an umbrella organization to a variety of Python-related projects, as well as sponsoring projects related to the development of the Python language. You can view a full list of participating sub-orgs here: https://python-gsoc.org/ideas.html Sub-orgs: - Borg Collective - backup tools - CVE Binary Tool - scanning for known security vulnerabilities - DIPY - 3d/4d+ imaging - Fury - scientific visualization tools - LPython - ahead of time compiler for python - MNE-Python - tools for human neurophysiological data - Mission Support System - atmospheric science tools for flight planning - PyData/Sparse - n-dimensional sparse arrays for pyData - PyElastica - simulation and modeling for slender structures",https://python-gsoc.org/index.html#gettingstarted,https://python-gsoc.org/ideas.html
QC Devs,Sustainable software for quantum chemistry & more,"python, github, c++, julia, jupyter","data science, scientific visualization, quantum chemistry, Computational Science, numerical algorithms",https://qcdevs.org/,"QC-Devs develops free, open-source, and cross-platform libraries for the computational sciences, focusing on theoretical and computational chemistry. Our goal is to make programming accessible to students and researchers, to catalyze scientific collaborations, and to promote precepts of sustainable software development. We're adapting some of the same principles to develop free and open-source educational materials (qc-edu.org) to modernize scientific education by integrating hands-on computation and computer programming.",https://qcdevs.org/join/qcdevs_gsoc/#contributor-guidance,https://qcdevs.org/join/qcdevs_gsoc/
QEMU,Open source machine emulator and virtualizer,"c, python, linux, rust","systems programming, kernel, compiler, emulator, hypervisor",https://qemu.org/,"The QEMU Project includes the QEMU open source machine emulator and virtualizer and also acts as an umbrella organization for the KVM Linux kernel module and rust-vmm community. When used as a machine emulator, QEMU can run operating systems and programs made for one machine (e.g. an ARM board) on a different machine (e.g. your own PC). By using dynamic translation, it achieves very good performance. When used as a virtualizer, QEMU achieves near native performances by executing the guest code directly on the host CPU. QEMU supports virtualization when executing under the Xen hypervisor or using the KVM kernel module in Linux. When using KVM, QEMU can virtualize x86, ARM, server and embedded PowerPC, and S390 guests.",https://wiki.qemu.org/Google_Summer_of_Code_2025,https://wiki.qemu.org/Google_Summer_of_Code_2025
R project for statistical computing,R software for statistical computing & graphics,"c, javascript, c++, r-project, fortran","visualization, machine learning, data science, graphics, statistics",https://www.r-project.org/,"R provides a wide variety of statistical and graphical techniques, and is highly extensible. R is often the tool of choice for research in statistical methodology. R is an integrated suite of software facilities for data manipulation, calculation and graphical display. It includes * an effective data handling and storage facility, * a suite of operators for calculations on arrays, in particular matrices, * a large, coherent, integrated collection of intermediate tools for data analysis, * graphical facilities for data analysis and display either on-screen or on hardcopy, and * a well-developed, simple and effective programming language which includes conditionals, loops, user-defined recursive functions and input and output facilities. The term “environment” is intended to characterize it as a fully planned and coherent system, rather than an incremental accretion of very specific and inflexible tools, as is frequently the case with other data analysis software. R, like S, is designed around a true computer language, and it allows users to add additional functionality by defining new functions. Much of the system is itself written in the R dialect of S, which makes it easy for users to follow the algorithmic choices made. For computationally-intensive tasks, C, C++ and Fortran code can be linked and called at run time. Advanced users can write C code to manipulate R objects directly. Many users think of R as a statistics system. We prefer to think of it of an environment within which statistical techniques are implemented. R can be extended (easily) via packages. There are about eight packages supplied with the R distribution and many more are available through the CRAN family of Internet sites covering a very wide range of modern statistics. R has its own LaTeX-like documentation format, which is used to supply comprehensive documentation, both on-line in a number of formats and in hardcopy.",https://github.com/rstats-gsoc/gsoc2022/wiki,https://github.com/rstats-gsoc/gsoc2025/wiki/table-of-proposed-coding-projects
Rizin,Rizin reverse engineering framework and toolset,"c, python, go, c++, qt","reverse engineering, computer security, debugging, emulation, disassembly",https://rizin.re,"The Rizin project is a fork of the famous Radare2 project that started in 2006. Since then the codebase has been rewritten multiple times, modularized and extended to support many new features. The Rizin project aims to provide stability, focus on the most important features, and provide a user friendly interface. Along with Cutter - a Qt-based GUI and the RzGhidra decompiler it makes the effective tool for everyday reversing tasks. Rizin is composed of a hexadecimal editor at its core, with support for several architectures and binary formats. It features code analysis capabilities, scripting, data and code visualization through graphs and other means, a visual mode, easy UNIX integration, a binary diffing engine for code and data, a shellcode compiler, multi-platform debug with reverse debug capabilities and much, much more!",https://rizin.re/gsoc/2024,https://rizin.re/gsoc/2025/
rocket.chat,Open source communications platform for the AI age,"javascript, typescript, node, LLM, generative ai","communications, messaging, group chat, Team Collaboration, Chat platform",https://github.com/RocketChat,"Open source team chat and communications platform Rocket.Chat is one of the largest active open source (permissive MIT license) nodeJS communications platform communities on GitHub, connecting 2,500+ global community contributors (across projects) from 30+ countries, with 41,700+ GitHub stars, 11,100 forks, 1,005+ total releases and 15,100+ issues since inception in 2015. Rocket.Chat is a team chat platform written in full-stack Typescript. It offers a fully featured team chat experience on modern browsers, comparable to Slack and Microsoft Teams. Mobile and desktop clients run on iOS, Android, Mac, Windows, and Linux. The server can scale from a small family messaging server for 5 users on a Raspberry Pi 5, to clustered micro-services configuration that can support hundred thousands of users. On-premises Rocket.Chat can ensure 100% complete security and privacy of your valuable communications/data. Rocket.Chat is now installed on over 500k servers and counts over 12m users worldwide. Federated communication support extends our reach exponentially. Users can set up Rocket.Chat on cloud or by hosting their own servers on-premises. Thanks to its extension support via Rocket.Chat Apps, and rich APIs, startups and innovators have customized Rocket.Chat into new products and services. Omnichannel extends reach to wherever user may be including WhatsApp, Instagram, Facebook Messenger and more. Increasingly, innovators in Generative AI and LLM app developers are launching their concepts on the Rocket.Chat platform to keep all data flows and communications 100% private and secure. Rocket.Chat has won multiple prizes such as a 2016 Bossie Award for Best Open Source Application and first prize in the 2017 edition of All Things Open’s Startup Competition. Rocket.Chat's community interacts 24 x 7 at the community Rocket.Chat server https://open.rocket.chat since 2015.",https://github.com/RocketChat/google-summer-of-code/blob/main/google-summer-of-code-2025.md#how-to-apply,https://github.com/RocketChat/google-summer-of-code/blob/main/google-summer-of-code-2025.md#-project-ideas
Rspamd,Rspamd is an email framework and spam filter,"c, lua, c++, rust, clickhouse","email, spam filtering",https://www.rspamd.com,"Rspamd is an email framework and spam filter
We are supporting and maintaining Rspamd: an Open Source email processing framework and spam filter.",https://github.com/rspamd/rspamd/blob/master/CONTRIBUTING.md,https://rspamd.com/gsoc2025_ideas.html
RTEMS Project,A real-time operating system for Earth & Space,"python, c/c++, assembly, posix","kernel, embedded, real-time, multicore, rtos",https://www.rtems.org/,"RTEMS (Real-Time Executive for Multiprocessor Systems) is a free real-time operating system (RTOS) designed for deeply embedded systems such as automobile electronics, robotic controllers, and on-board satellite instruments. RTEMS is free open source software that supports multi-processor systems for over a dozen CPU architectures and over 150 specific system boards. In addition, RTEMS is designed to support embedded applications with the most stringent real-time requirements while being compatible with open standards such as POSIX. RTEMS includes optional functional features such as TCP/IP and file systems while still offering minimum executable sizes under 20 KB in useful configurations. The RTEMS Project is the collection of individuals, companies, universities, and research institutions that collectively maintain and enhance the RTEMS software base. As a community, we are proud to be popular in the space application software and experimental physics communities. RTEMS has been to Venus, circles Mars, is aboard Curiosity, is in the asteroid belt, is on its way to Jupiter, and is circling the sun. It is in use in many high energy physics research labs around the world. There are many RTEMS users who do not belong to the space or physics communities, but our small part in contributing to basic scientific knowledge makes us proud.",https://projects.rtems.org/gsoc/,https://projects.rtems.org/gsoc/
SageMath,Open-source mathematics software system,"python, cython","mathematics, education, research",https://www.sagemath.org,"Mathematicians, scientists, researchers, and students need a powerful tool for their work or study. SageMath is a freely available open-source mathematical software system bundling the functionality of many software libraries, exposing their features in a common interface and extending on top of this with its own powerful algorithms. By leveraging the flexibility and universality of the underlying Python interpreter, SageMath is able to accommodate for a vast range of their requirements. The mission of SageMath is to create a viable open-source alternative to all major proprietary mathematical software systems. Python is the main programming language inside the SageMath library and also the language of choice for all interactions with the built-in objects and functions for expressing mathematical concepts and calculations. Besides a command-line and programming-library interface, its primary user interface is a dynamic self-hosted website. From the perspective of a user, the interface language is Python, but with a thin extension built directly on top of it. Almost all areas of mathematics are represented in SageMath, at various levels of sophistication. This includes symbolic calculus, 2D and 3D graphics, polynomials, graph theory, group theory, abstract algebra, combinatorics, cryptography, elliptic curves and modular forms, numerical mathematics, linear algebra and matrix calculations (over various rings), support for parallel computing, and a powerful coercion framework to “mix” elements from different sets for calculations. SageMath’s features also expand into neighboring fields like Statistics and Physics.",https://wiki.sagemath.org/GSoC/Contributors,https://wiki.sagemath.org/GSoC/2025
Scala Center,Guide and support the Scala community,"jvm, functional programming, scala, scala.js, scala native","education, compilers, web, tooling, gpu",https://scala-lang.org/,"We are an independent not-for-profit center established at EPFL. Scala Center's Mission is to guide and support the Scala community, coordinate and develop open-source libraries and tools for the benefit of all Scala users, provide deep, and quality, educational materials for Scala.",https://google.github.io/gsocguides/student/writing-a-proposal,https://github.com/scalacenter/GoogleSummerOfCode
ScummVM,Adventure and RPG preservation project,"python, opengl, c++, assembly, php","games, game engines, software preservation, software archeology",https://www.scummvm.org/,"ScummVM is a game preservation project with a quickly growing code base since more than 20 years. Originally focused on 2D Point&Click adventure games, its scope widened in 2016 to RPG thanks to successful GSoC students and to 3D games in 2020 after the merge with its sister project, ResidualVM. The purpose is only to replace the game executable, not to enhance or replace the game assets.",https://wiki.scummvm.org/index.php/GSoC_Application,https://wiki.scummvm.org/index.php?title=Summer_of_Code/GSoC_Ideas_2025
Society for Arts and Technology ,Technological tools for creativity and industry,"python, javascript, c++, qt, esp32","computer vision, graphics, multimedia, Telepresence, digital arts",https://sat.qc.ca,"The Society for Arts and Technology [SAT] is a non-profit organization recognized internationally for developing and creatively using immersive technologies, computer vision, embedded systems, and connectivity tools. Founded in 1996, its triple mission as a center for the arts, training and research, is to enable and host teleimmersive multisensorial experiences. SAT creates open-source tools for pose detection, orchestration, gestural control, interaction, tele-copresence, audio spatialization, haptic feedback, and immersive multisensory multimedia authoring.",https://sat-mtl.gitlab.io/collaborations/google-summer-of-code/posts/2025-news/2025-share/,https://sat-mtl.gitlab.io/collaborations/google-summer-of-code/categories/ideas/
Software and Computational Systems Lab at LMU Munich,Algorithms and Tooling for Software Verification,"python, javascript, java, grpc, Quarkus","cloud, software verification, benchmarking, program analysis, SAT & SMT solving",https://www.sosy-lab.org/,"The Software and Computational Systems Lab is a research group at LMU Munich, one of the leading universities in Germany. We focus on the development of new models and algorithms to efficiently analyze software systems and emphasize on tool implementations of the theoretical concepts. For GSoC 2024, we propose ideas involving several aspects of software analysis, from implementing and benchmarking verification algorithms to incorporating backend logic solvers. Here is a selection of the open-source projects developed by our group:
CPAchecker is an award-winning framework for formal verification of C programs. It is written in Java and based on a highly modular architecture that allows one to develop and combine a wide range of different analyses. CPAchecker has helped to find hundreds of bugs in the Linux kernel.
CPA-Daemon is a gRPC-based microservice that enables users to run CPAchecker in a cloud setup, with a focus on ease of use and continuous verification.
JavaSMT is a common API layer for accessing various SMT solvers from Java programs without having to use solver-specific APIs and care about subtle details. It supports the majority of common SMT solvers and is used by a wide range of projects.
PJBDD is a multi-threaded Binary Decision Diagram (BDD) library written in Java. It supports concurrent computation, parallel operations, and automated resource management.
BenchExec is a benchmarking framework (written in Python) that uses modern Linux features such as cgroups and namespaces to create benchmarking containers and measure their resource usage.
For a more detailed description and some prospective GSoC topics, please visit our webpage. You are also welcome to suggest your own ideas!",https://www.sosy-lab.org/gsoc/gsoc2025.php#instructions,https://www.sosy-lab.org/gsoc/gsoc2025.php
SQLancer,Automatically testing database systems,"java, sql","fuzzing, Automated Testing, Logic bugs, Database systems",https://www.sqlancer.com,"SQLancer is an automated testing tool that finds logic bugs in database systems (rather than in the databases themselves). Logic bugs are bugs that cause a database system to compute an incorrect result for a given query and a database on which the query is executed. To that end, SQLancer semi-randomly generates databases and queries, whose results are then automatically validated. SQLancer has found hundreds of bugs in database systems such as SQLite, MySQL, DuckDB, CockroachDB, and TiDB.",https://github.com/sqlancer/sqlancer/wiki/GSoC-2025-Ideas#contributor-guidance,https://github.com/sqlancer/sqlancer/wiki/GSoC-2025-Ideas
