Organizations,slogan,tech,topic,website,descripton,link,ideas
52 North Spatial Information Research GmbH,Innovative ideas & technologies in geoinformatics,"javascript, android, java, web services, ogc standards","citizen science, spatial information infrastructures, open standards, data analytics, Geoinformation",https://52north.org/ ,"Innovative ideas & technologies in geoinformatics 52°North is an open source initiative in the field of geoinformatics. Core topics of our activities are for example sensor web, web-based geoprocessing and earth observation.",https://52north.org/software/contribute/ ,https://52north.org/outreach-dissemination/google-summer-of-code/project-ideas/
AboutCode,"Scan code for origin, license and vulnerabilities","python, javascript, Django+PostgreSQL, C/Rust/Go","dependencies, vulnerabilities, SoftwareCompositionAnalysis, License, SBOM",https://aboutcode.org ,"AboutCode.org is a community of open source developers who are trying to make open source easier to use by providing open source tools to discover, identify and track open source components (aka. Software Composition Analysis – SCA). This includes tools, data and standards for code origin, FOSS licenses and security vulnerabilities.",https://github.com/aboutcode-org/aboutcode/wiki/GSOC-2025,https://github.com/aboutcode-org/aboutcode/wiki/GSOC-2025-Project-Ideas
Accord Project,Open source software for smart legal contracts,"python, javascript, json, react, artificial intelligence","natural language processing, data modeling, legal technology, contract management, document assembly",https://accordproject.org,"Accord Project champions the importance of contract text alongside computer-code when automating contracts. This is often referred to as Computable Contracts or Smart Legal Contracts. The Accord Project is a non-profit, collaborative, initiative developing an ecosystem and open source tools for computational contracts. The community includes participants from law firms, technology companies, universities, government and private individuals. Today, the community maintains a technology neutral foundation for smart legal contracts, based on the union of legal text with a machine readable data model, and machine executable logic. This definition of a smart legal contract is recognised across the industry, including by statutory and standards bodies. Accord Project is a top-level Linux Foundation project.",https://github.com/accordproject/techdocs/blob/master/CONTRIBUTING.md,https://github.com/accordproject/techdocs/wiki/Google-Summer-of-Code-2025-Ideas-List
AFLplusplus,State of the art fuzzing for better security,"llvm, rust, fuzzing, qemu","fuzzing, ci",https://aflplus.plus,"State of the art fuzzing for better security
We are dedicated to provide the most effective fuzzing frameworks. Our work includes AFL++, the most effective and flexible fuzzer, and libafl, a library to build your own fuzzer with the most modern techniques and technologies.",https://github.com/AFLplusplus/LibAFL/blob/main/CONTRIBUTING.md,https://github.com/AFLplusplus/LibAFL/issues/2992
Alaska,"Many Traditions, One Alaska","python, mysql, java, matlab, dicom","deep learning, neuroscience, radiology, heathcare, Polar Science",https://www.uaa.alaska.edu/research,"Many Traditions, One Alaska
Alaska Project Ideas are mentored by the researchers and collaborators of the University of Alaska and supported by other open-source entities in Alaska, such as Alaska Dev Alliance. We aim to represent the open-source ecosystem of the 49th state, Alaska. Anchorage, the largest city in Alaska, has a vibrant open-source community. Through this GSoC initiative, industrial experts who are part of the Alaska Developer Alliance and faculty and researchers from the University of Alaska Anchorage (UAA) and the University of Alaska Fairbanks (UAF) join hands to provide a perfect mentoring experience for interested contributors globally. We offer a glimpse of this northern state and its tech landscape to the Lower 48 and the outside world through this open-source remote summer coding program organized and funded by Google. Our projects focus on healthcare, climate science, polar science, and other research fields critical to the Circumpolar North and the rest of the world.",https://github.com/uaanchorage/GSoC/blob/main/CONTRIBUTOR-GUIDE.md,https://github.com/uaanchorage/GSoC
AnkiDroid,AnkiDroid makes remembering things easy,"android, rust, kotlin, mobile","education, mobile, android, user generated content, Flashcards",https://github.com/ankidroid/Anki-Android,"AnkiDroid makes remembering things easy
Memorize anything with AnkiDroid!

AnkiDroid lets you learn flashcards very efficiently by showing them just before you would forget. It is fully compatible with the spaced repetition software Anki (including synchronization), which is available for Windows/Mac/Linux/ChromeOS.

Study all sorts of things wherever and whenever you want. Make good use of idle times on bus trips, in supermarket queues or any other waiting situation!

Create your own flashcard decks or download free decks compiled for many languages and topics (more than 6000 available).

Add material through the desktop application Anki or directly through AnkiDroid. The application even supports adding material automatically from a dictionary!

★ Key features:
• supported flashcard contents: text, images, sounds, LaTeX & MathJax
• spaced repetition (supermemo 2 algorithm)
• text-to-speech integration
• check your pronunciation
• more than 6000 premade decks
• progress widget
• detailed statistics
• syncing with AnkiWeb
• open source",https://github.com/ankidroid/Anki-Android/wiki/Google-Summer-of-Code,https://docs.google.com/document/d/1Va6IWEYcWTkK4KDtyoFxtOKzpdcYe54GdrVpuMcFvlI/edit?tab=t.0#heading=h.dzo0rbsbdvvi
AOSSIE,Australian Umbrella Org for Open-Source Projects,"python, javascript, android, flutter, Blockchain","web, machine learning, natural language processing, mobile, backend",https://www.aossie.org,"Australian Umbrella Org for Open-Source Projects
We are an Australian not-for-profit umbrella organization for open-source projects. We believe the open-source philosophy provides a resource-efficient channel to transfer knowledge and achieve innovation and education. In 2025, we will mentor contributors on the following projects: Agora (Scala, Javascript): a library of vote-counting algorithms for democratic elections. Mind the Word (Javascript, HTML, CSS): a browser extension that helps users to learn new languages. Crowd Alert (React-Native, Expo, Jest): a cross-platform mobile application that allows users to post and view incidents around them Carbon Footprint (Javascript, HTML, CSS): a browser extension that raises environmental awareness regarding C02 emissions. Starcross (iOS, C++, OpenGL, Objective-C): Starcross is a hand-held planetarium for your iOS device. Can be used to identify stars, planets, nebulae and more. Social Street Smart (Chrome Extension): Social Street Smart is a Chrome Extension that makes the Internet a more productive place for users. Using algorithms and artificial intelligence, the extension hopes to face the major problems of the modern Internet. Monumento(Mobile Application): to provide users with a unique experience of exploring and learning more about the various monumental structures all around the world within the app. We have a diverse group of mentors, including GSoC students from previous years who decided to become long-term contributors as well as academics with extensive experience in supervising undergraduate, M.Sc. and PhD students on theses and projects, whose results are often published and presented in the most prestigious conferences of our research fields.",https://aossie.gitlab.io/pages/gsoc-details.html,https://aossie.org/ideas
Apache DataFusion,Foundational library for DBs and compute engines,"python, rust, sql, arrow","databases, big data, OLAP",https://datafusion.apache.org/,"Foundational library for DBs and compute engines
DataFusion is an extensible query engine written in Rust that uses Apache Arrow as its in-memory format. “Out of the box,” DataFusion offers SQL and Dataframe APIs, excellent performance, built-in support for CSV, Parquet, JSON, and Avro, extensive customization, and a great community. Python Bindings are also available. DataFusion features a full query planner, a columnar, streaming, multi-threaded, vectorized execution engine, and partitioned data sources. You can customize DataFusion at almost all points including additional data sources, query languages, functions, custom operators and more.",https://datafusion.apache.org/contributor-guide/gsoc_application_guidelines,https://datafusion.apache.org/contributor-guide/gsoc_project_ideas
"Apache Software Foundation
",Open source software to the public free of charge,"c, java, c++","big data, cloud, libraries, other",https://apache.org,"Open source software to the public free of charge
The Foundation provides an established framework for intellectual property and financial contributions that simultaneously limits contributors potential legal exposure. Through a collaborative and meritocratic development process, Apache projects deliver enterprise-grade, freely available software products that attract large communities of users. The pragmatic Apache License makes it easy for all users, commercial and individual, to deploy Apache products.",https://community.apache.org/gsoc/,https://cwiki.apache.org/confluence/display/COMDEV/GSoC+2025+Ideas+list
API Dash,Next-gen Open Source AI powered API DevTool,,,https://apidash.dev,"Next-gen Open Source AI powered API DevTool
API Dash is a beautiful open-source cross-platform (macOS, Windows, Linux, Android & iOS) API Client built using Flutter & powered by AI which can help you easily create & customize your HTTP & GraphQL API requests, visually inspect responses and generate API integration code.",https://github.com/foss42/apidash/discussions/564,https://github.com/foss42/apidash/discussions/565
ArduPilot,World's most advanced autonomous vehicle software,"python, lua, c++, pixhawk","robotics, ai, Drone, autonomous vehicle, unmanned vehicle",https://ardupilot.org/,"World's most advanced autonomous vehicle software
ArduPilot is the world's most widely used open source flight code software for unmanned autonomous vehicles including planes, multicopters, helicopters, cars, boats, submarines, blimps, antenna trackers and much more. Written primarily in C++, ArduPilot supports over 100 different types of autopilot hardware including the well known Pixhawk autopilot. Our team motto, ""Versatile, Trusted, Open"" reflects our team's aim to provide high quality autopilot software that reliably supports a huge variety of frames, sensors and use cases. The software is open but so is the team, always welcoming of new contributors whether they be software developers, wiki documentors, testers or users.",https://ardupilot.org/dev/docs/gsoc.html,https://ardupilot.org/dev/docs/gsoc-ideas-list.html
AsyncAPI,Building the future of Event-Driven Architectures,"javascript, java, go, typescript, RAML","web, api, cloud, Architectures",https://www.asyncapi.com/,"Building the future of Event-Driven Architectures
AsyncAPI is an Open-Source tool to easily build and maintain your event-driven architecture. All are powered by the AsyncAPI specification, the industry standard for defining asynchronous APIs.",https://github.com/asyncapi/community/blob/master/CONTRIBUTING.md,https://github.com/asyncapi/community/blob/master/mentorship/summerofcode/2025/asyncapi-gsoc-ideas-page.md
BeagleBoard,Open hardware computing for educators and makers,"linux, fpga, risc-v, dsp, Zephyr RTOS","robotics, iot, ai, software defined radio, Personal Server",https://www.beagleboard.org,"Open hardware computing for educators and makers
Enabling individuals to define the connected devices in their lives, BeagleBoard.org is the open-source, community-driven hardware precursor to Raspberry Pi, continuing to improve performance, access and openness for embedded development. The community is diverse with many professional developers utilizing the open source designs to build production solutions. Supported by a non-profit foundation, the community seeks to improve access to technology for making embedded devices using open source software and hardware. On-going developments include open designs around DSP/AI/ML accelerators, RISC-V cores, FPGA-based open hardware developement, software-defined radios, robotics/motor control, privacy-oriented personal servers, musical instruments, lighting displays, and open standards that simplify and clarify embedded systems technology.",https://bbb.io/gsoc,https://gsoc.beagleboard.io/ideas/
Blender Foundation,The Freedom to Create,"c, python, opengl, c++, vulkan","games, graphics, 3d, rendering, animation",https://www.blender.org,"The Freedom to Create
Blender is a free and open source 3D creation suite, providing individuals and small teams a complete pipeline for 3D graphics, modeling, animation and games. Blender is being made by 100s of active volunteers from all around the world; by studios and individual artists, professionals and hobbyists, scientists and students, vfx experts and animators, and so on. All of them are united by an interest to have access to a fully free/open source 3D creation pipeline. Blender Foundation supports and facilitates these goals - even employs a staff for that - but fully depends on the online community to achieve it.",https://developer.blender.org/docs/programs/gsoc/,https://developer.blender.org/docs/programs/gsoc/ideas/
BRL-CAD,3D CAD & other computer-aided tech (CAx),"python, c/c++, opengl, opencl, scripting","geometry, 2d/3d graphics, ray tracing, high-performance computing, deep neural net rendering",https://opencax.github.io/,"3D CAD & other computer-aided tech (CAx)
This is the place to be if you love computer graphics. We do 2D/3D modeling, 3D printing, solid geometry, design, and more. Depending on the project, you have the opportunity to work with C/C++, Python, OpenGL, OpenCL, Qt, Javascript, and more... Help us develop open source computer-aided technologies (CAx)!


We operates as an umbrella organization with several CAx communities including:


- OpenSCAD is a solid 3D modeler with a rich syntax for programmable geometry.
- LibreCAD is a 2D modeling system specializing in blueprint-style drawings and draftings.
- IfcOpenShell is a library for working with standard IFC building model data.
- BRL-CAD is a solid modeling suite with conversion and advanced solid ray tracing features.
- Manifold is a solid geometry mesh processing library.

We want to select at least one student for each, so feel free to ask us where to start.",https://opencax.github.io/gsoc_checklist.html,https://github.com/opencax/GSoC/issues?q=is%3Aissue+is%3Aopen+label%3A%22GSoC+2025%22
cBioPortal for Cancer Genomics,Aid discovery in complex cancer genomics data,"mysql, javascript, java, react, typescript","genomics, cancer, bioinformatics, big data, precision medicine",https://www.cbioportal.org/,"Aid discovery in complex cancer genomics data
The cBioPortal for Cancer Genomics is a resource designed to provide broad community access to cancer genomic data. It provides a unique user­-friendly and ""biology­-centric computational user interface"", with the goal of making genomic data more easily accessible to translational scientists, biologists, and clinicians. The interface was explicitly built and continues to evolve with careful usability studies involving multiple biological and clinical users, and an active and engaged user base. The public instance of cBioPortal (https://cbioportal.org/) is now one of the most popular online resources for cancer genomics data and attracts more than 4,000 unique visitors (cancer researchers and clinicians) per day. The two papers documenting the cBioPortal Cerami et al. Cancer Discov. 2012 & Gao et al. Sci. Signal. 2013 have been cited more than 5,600 and 5,100 times, respectively, since their publication. There are more than 30 actively used cBioPortal instances in hospitals, universities, pharmaceutical companies, and other institutes all over the globe. We are a group of software engineers, bioinformaticians, and cancer biologists building software solutions for precision medicine for cancer patients. Our overall goal is to build infrastructure to support clinical decisions for personalized cancer treatment by utilizing “big data” of cancer genomics and patient clinical profiles. Our multi-institutional team currently has more than 30 active members, primarily from Memorial Sloan Kettering Cancer Center, the Dana-Farber Cancer Institute, Princess Margaret Cancer Centre, Children's Hospital of Philadelphia, and The Hyve, a bioinformatics company from the Netherlands.",https://github.com/cBioPortal/GSoC,https://github.com/cBioPortal/gsoc/issues?q=is%3Aissue%20state%3Aopen%20label%3AGSoC-2025
CCExtractor Development,"TV, Rust, Flutter, Linux, VR and C. In any order.","c, linux, rust, flutter","vr, linux, video, subtitles, mobile",https://www.ccextractor.org,"TV, Rust, Flutter, Linux, VR and C. In any order.
CCExtractor Development is the creator of the de-facto captions extraction tool - CCExtractor. It is the one tool that is free, portable, open source and community managed that can take a recording from a TV show and generate an external subtitle file for it. If you regularly watch content with subtitles you download from fan sites - you should know that the source file is most likely generated by CCExtractor. If you are a student in a university that uses subtitles for natural language study, you should know that most likely we are involved somehow. While we already support subtitles from North America, Europe, Australia and more, our world map is not yet complete. We are actively looking for students that want to help us fill the gaps. We also want to automate many of the processes that are currently done manually, such as achieving perfect sync, our media file management. In addition to continuously evolve our core tool, we have a growing number of new projects: support, AI, rclone, cloud, flutter, peer-to-peer and a few more that are starting to take shape. The best part is - students have flexibility of choosing projects from a wide range of topics & technologies and even propose their own. We provide exceptional resources for students. Read more about the perks on our website. We’re very excited to take part in GSoC for the 9th time. Most of our past students are still involved and are active in the community, which simply goes on to show how friendly and approachable is the environment. If you want to be a part of such community and help achieve our goals, come join our Slack group or mailing list!",https://ccextractor.org/docs/ideas_page_for_summer_of_code_2025/#your-proposal,https://ccextractor.org/docs/ideas_page_for_summer_of_code_2025/
Center for Translational Data Science,Develop translational data science.,"golang, docker, postgres, gpu, LLMs","machine learning, artificial intelligence, devops, MLOps, Data Meshes",https://ctds.uchicago.edu,"Develop translational data science.
We develop and operate large-scale data platforms to support research in topics of societal interest, including cancer, cardiovascular disease, inflammatory bowel disease (IBD), birth defects, veterans’ health, pain management, opioid use disorder, and environmental science. We also develop new machine learning and AI algorithms over the data in our platforms.",https://ctds.uchicago.edu,https://docs.google.com/document/d/1kiEDB6tw2xD8Qj3uxpSELjazW35llHM1a9Nt_LQKwHw/edit?tab=t.0#heading=h.culkmufwpils
Ceph,The Future of Storage,"python, javascript, c++","distributed systems, Software-Defined-Storage",https://ceph.io/en/,"The Future of Storage
An open-source storage platform that implements storage on a single distributed computer cluster and provides a 3-in-1 interface for object-, block- and file-level storage.",https://docs.ceph.com/en/latest/dev/developer_guide/,https://ceph.io/en/developers/google-summer-of-code/
CERN HSF,Umbrella for Particle Physics-related projects,"python, c/c++, data analysis, artificial intelligence, container orchestration","machine learning, big data, algorithmics, particle physics, Performance Optimisation",http://hepsoftwarefoundation.org/activities/gsoc.html,"Umbrella for Particle Physics-related projects
CERN-HSF (High-Energy Physics Software Foundation) is the umbrella organization for high-energy physics-related projects in GSoC. The HEP Software Foundation (http://hepsoftwarefoundation.org/) facilitates the coordination of common international efforts in high-energy physics software and computing. CERN (European Organization for Nuclear Research, https://home.cern) has participated in GSoC since 2011 as the CERN-SFT group, which provides common software for CERN's experiments. In 2017, the program expanded to include many software projects from the whole field of high-energy physics. The vast majority of our GSoC projects do not require any physics knowledge. The experiments at CERN, such as the Large Hadron Collider, the world’s largest and most powerful particle accelerator (http://home.cern/topics/large-hadron-collider) try to answer fundamental questions about the Universe. For example, what is the nature of mass? What are the elementary building blocks of the Universe? What was the early Universe like? What is the nature of dark matter and dark energy? Why is there an asymmetry between matter and antimatter? In 2012, LHC experiments announced the discovery of a new particle, the Higgs Boson, that helps explain how particles obtain mass. Also, CERN is the birthplace of the World Wide Web. Today, particle physicists are working on analyzing the data from the experiments to study the properties of the newly discovered particle and to search for new physics, such as dark matter or extra dimensions. This requires a lot of sophisticated software. The open-source high-energy physics projects to which students can contribute during GSoC span many high-energy physics software projects: data analysis, detector and accelerator simulation, event reconstruction, data management and many others. We look forward to your contributions!",https://hepsoftwarefoundation.org/activities/gsoc.html#for-students,https://hepsoftwarefoundation.org/gsoc/2025/summary.html
CGAL Project,C++ library of computational geometry,"c++, qt","geometry, mesh processing, computation geometry, geometry processing",https://www.cgal.org,"C++ library of computational geometry
CGAL is a software library that offers a number of reliable geometric data structures and algorithms. CGAL components operate in 2D and 3D, and sometime in arbitrary dimensions. Examples of components include convex hulls, convex decomposition, Delaunay triangulations, Voronoi diagrams, polygonal surface mesh data-structures, mesh generation, Boolean operations, envelope computations, intersection detection, surface reconstruction, and subdivision surfaces. CGAL is used in a variety of application domains such as CAD/CAM (computer aided design and modeling), GIS (geographic information systems), geophysics, image processing, molecular biology, robotics, motion planning, and graphics. CGAL is written in C++ and rigorously adheres to the generic-programming paradigm. CGAL became an Open Source project in 2003. Most of CGAL is under the GPL v3+ license, and some core parts are under the LGPL v3+. The semi-annual releases have currently about 10,000 downloads. CGAL is commercially supported by the spin-off company GeometryFactory.",https://github.com/CGAL/cgal/wiki/Project-Ideas#information-candidates-should-supply,https://github.com/CGAL/cgal/wiki/Project-Ideas
