Organizations,slogan,tech,topic,website,descripton,link,ideas
Learning Equality,Building equity in education to transform lives,"python, javascript, django, vue.js","education, distributed databases, offline, learning",https://learningequality.org/,"Building equity in education to transform lives
Learning Equality is an education technology nonprofit that develops and maintains Kolibri, an adaptable set of open solutions specially designed to support teaching and learning with technology but without the Internet for the half of the world that still lacks access to connectivity. Kolibri is centered around an offline-first learning platform that runs on a variety of low-cost and legacy devices. It is complemented by a curricular tool, a library of open educational materials, and a toolkit of resources to support training and implementation. These tools are open and available in a variety of languages, to better support learners and educators globally. As a community-driven nonprofit, Learning Equality works closely to co-design Kolibri with a core network of collaborators, including national NGOs, UN agencies, government, and corporate partners. We also adopt a needs-based approach, constantly gathering insights from our community to inform the development of our tools. Through its do-it-yourself adoption model and strategic collaborations, Kolibri has reached learners and educators in more than 220 countries and territories since its launch in 2017. Given our offline access and distribution model, we learn about usage of Kolibri through a combination of telemetry ping backs of high level, aggregate, anonymized statistics, data from partners, and use of our Kolibri Data Portal. Since instances of Kolibri never need to connect to the Internet to be used, we do not know about usage across every instance, which is why this is an informed estimate from years of data.",https://learningequality.org/r/gsoc-contributor-guidelines,https://docs.google.com/document/d/e/2PACX-1vT49WKgbsAIUoJ0jJS8LTWWm7UTByM0Pw3qt0KgyU_BShB1oGtZBkrEWuannFsRMVvGd0QBytZt8blh/pub
LibreOffice,LibreOffice is a free and open source office suite,"python, java, c++","office suite, desktop application, end user application",https://www.libreoffice.org/,"LibreOffice is a free and open source office suite
LibreOffice is a modern Free & Open Source Office suite, one of the largest open source projects, and used by millions of users worldwide. LibreOffice is compatible with many file formats like Microsoft® Word, Excel, PowerPoint and Publisher. At its heart though, LibreOffice is built around an open standard, the OpenDocument Format, as its native file format. LibreOffice is developed by users who, just like you, believe in the principles of Free Software and in sharing their work with the world in non-restrictive ways. The development of LibreOffice is supported by The Document Foundation which provides the infrastructure for the project. We believe that users should have the freedom to run, copy, distribute, study, change and improve the software that we distribute. While we do offer no-cost downloads of the LibreOffice suite of programs, Free Software is first and foremost a matter of liberty, not price. We campaign for these freedoms because we believe that everyone deserves them. Though the members of our community hail from many different backgrounds, we all value personal choice and transparency, which translates practically into wider compatibility, more utility, and no end-user lock-in to a single product. We believe that Free Software can provide better-quality, higher-reliability, increased-security, and greater-flexibility than proprietary alternatives. LibreOffice is a large project (approx. 6MLOC), which makes it interestingly complex, but at the same time, provides a place for all sorts of contribution & skills. The community behind LibreOffice is the heart of the project, without which we would not have the resources to continue developing our software. The passion and drive that every individual brings to the community results in collaborative development that often exceeds our own expectations. With tons of different roles in the project, we invite everyone to join us in our work and help us to make LibreOffice known, prosper, and accessible to all.",https://wiki.documentfoundation.org/Development/GSoC/2025#How_to_apply,https://wiki.documentfoundation.org/Development/GSoC/Ideas
libssh,The SSH library,"c, git, ci, ssh, sftp","security, cryptography",https://www.libssh.org/,"The SSH library
This project is for programmers needing a working SSH implementation by the mean of a library. The complete control of the client is made by the programmer. With libssh, you can remotely execute programs, transfer files, use a secure and transparent tunnel for your remote programs. With its Secure FTP implementation, you can play with remote files easily, without third-party programs others than libcrypto (from openssl), libgcrypt or mbedTLS.",https://www.libssh.org/development/google-summer-of-code/,https://www.libssh.org/development/google-summer-of-code/
Liquid Galaxy project,We code immersive and interactive apps with GEarth,"linux, android, nodejs, flutter, Google Earth","visualization, artificial intelligence, networking, maps, ux",https://www.liquidgalaxy.eu,"We code immersive and interactive apps with GEarth
Liquid Galaxy is a remarkable panoramic system that is tremendously compelling. It started off as a Google 20% project to run Google Earth across a small cluster of PC's and it has grown from there! Liquid Galaxy hardware consists of one or more computers driving multiple displays. Liquid Galaxy applications have been developed using a master/slave architecture. The view orientation of each slave display is configured in reference to the view of the master display. Navigation on the system is done from the master instance and the location on the master is broadcast to the slaves over UDP. The slave instances, knowing their own locations in reference to the master, then change their views accordingly. The Liquid Galaxy Project, while making use of Google Earth software, does not develop the Google Earth code-base itself. Google Earth is not open-source software, although it is free (as in beer). Instead, the Liquid Galaxy Project works on extending the Liquid Galaxy system with open-source software both improving its administration and enabling open-source applications, so that content of various types can be displayed in the immersive panoramic environment. Artificial Intelligence focus: 2023 was the AI year, and as the mainstream market demands, 2024 and the coming years will still be a very hot topic. At the Liquid Galaxy community, we’ve been using AI for years to obtain data to be shown on Google Earth for our projects, using TensorFlow and more. Last year we made some specific advances incorporating an Artificial Intelligence server inside our rig LAN, managing with dockers the different projects, implementing local models for different functionalities, and having artificial voices in our system. Also last year we incorporated Google’s Mediapipe-based project Gameface to be able to control the Liquid Galaxy just with your face! This year also we’ll allow the use of Cloud-based services, like Google’s models Gemini and Palm2.",https://www.liquidgalaxy.eu/2023/09/google-summer-of-code-2024-unique-post.html#master-proposal,https://www.liquidgalaxy.eu/2024/11/unique-post-for-gsoc-2025-at-liquid.html
LLVM Compiler Infrastructure,LLVM Compiler Infrastructure,"llvm, c++, clang, mlir","compilers, development tools, libraries",http://www.llvm.org,"LLVM Compiler Infrastructure
The LLVM Project is a collection of modular and reusable compiler and toolchain technologies. Despite its name, LLVM has little to do with traditional virtual machines. The name ""LLVM"" itself is not an acronym; it is the full name of the project. LLVM began as a research project at the University of Illinois, with the goal of providing a modern, SSA-based compilation strategy capable of supporting both static and dynamic compilation of arbitrary programming languages. Since then, LLVM has grown to be an umbrella project consisting of a number of subprojects, many of which are being used in production by a wide variety of commercial and open source projects as well as being widely used in academic research. In addition to official subprojects of LLVM, there are a broad variety of other projects that use components of LLVM for various tasks. Through these external projects you can use LLVM to compile Ruby, Python, Haskell, Rust, D, PHP, Pure, Lua, Julia, and a number of other languages. A major strength of LLVM is its versatility, flexibility, and reusability, which is why it is being used for such a wide variety of different tasks: everything from doing light-weight JIT compiles of embedded languages like Lua to compiling Fortran code for massive super computers.",https://discourse.llvm.org/t/gsoc-2022-projects-proposals-and-other-information/60386,https://llvm.org/OpenProjects.html
Machine Learning for Science ,Machine learning applications in science,"python, machine learning, c++, data analysis, artificial intelligence","machine learning, science and medicine, algorithms, physics, astronomy",https://ml4sci.org/,"Machine learning applications in science
Machine Learning for Science (ML4SCI) is an umbrella organization for machine learning-related projects in science. ML4SCI brings together researchers from universities and scientific laboratories with motivated students to join existing scientific collaborations and contribute to cutting edge science projects across a wide variety of disciplines. Students work on existing problems to develop new machine learning-based approaches and produce open source code that directly contributes to solving these scientific challenges. ML4SCI currently includes projects from a variety of fields. For example, some of them explore the uses of machine learning for particle reconstruction and classification in high-energy physics, deep learning-based searches for dark matter in astrophysics, applications of machine learning techniques to data returned from planetary science missions, applications of quantum machine learning to science, and others. Machine learning ideas and approaches can be broadly applicable and transferable across the scientific domains. The goals of ML4SCI projects are to grow the open-source community in machine learning for science by addressing important scientific challenges and transferring the knowledge and tools of machine learning across the disciplines. We look forward to your applications!",https://ml4sci.org/,https://ml4sci.org/
MariaDB,The fastest growing Open Source Database,"python, javascript, c/c++, perl, databases","Database Engines, SQL Features",https://mariadb.org,"The fastest growing Open Source Database
MariaDB Foundation is the non-profit organization behind MariaDB Server, the fastest growing open source databases. MariaDB Foundation's mission is to ensure the continuity of the MariaDB Server code as well as foster and facilitated collaboration within the MariaDB ecosystem. As part of GSoC, MariaDB Foundation seeks to bring more developers into the MariaDB Server (and related projects) code base.",https://mariadb.org/gsoc2022-instructions/,https://mariadb.com/kb/en/google-summer-of-code-2025/
MBDyn,Open Source Multibody Simulation,"python, c++","robotics, scientific computing, multibody dynamics, aeroelasticity, Structural engineering",http://www.mbdyn.org/,"Open Source Multibody Simulation
MBDyn is the first free general purpose Multibody Dynamics analysis software. It has been developed at the Dipartimento di Scienze e Tecnologie Aerospaziali (formerly Dipartimento di Ingegneria Aerospaziale) of the University ""Politecnico di Milano"", Italy. MBDyn features the integrated multidisciplinary simulation of multibody, multiphysics systems, including nonlinear mechanics of rigid and flexible bodies (geometrically exact & composite-ready beam and shell finite elements, component mode synthesis elements, lumped elements) subjected to kinematic constraints, along with smart materials, electric networks, active control, hydraulic networks, and essential fixed-wing and rotorcraft aerodynamics. MBDyn simulates the behavior of heterogeneous mechanical, aeroservoelastic systems based on first principles equations. MBDyn can be easily coupled to external solvers for co-simulation of multiphysics problems, e.g. Computational Fluid Dynamics (CFD), terradynamics, block-diagram solvers like Scicos, Scicoslab and Simulink, using a simple C, C++ or Python peer-side API. MBDyn is being actively developed and used in the aerospace (aircraft, helicopters, tiltrotors, spacecraft), wind energy (wind turbines), automotive (cars, trucks) and mechatronic fields (industrial robots, parallel robots, micro aerial vehicles (MAV)) for analysis and simulation of complex systems dynamics. The extension of available analysis domains to new models and the introduction of new analysis domains is planned, and problem-driven: if you need to solve a specific problem, let us know. Run-time loading of user-defined modules is leveraged to let users extend the feature library (elements, drives, constitutive laws, and more). On GNU/Linux, real-time execution is supported under RTAI, the Real-Time Application Interface, and POSIX tight scheduling.",https://public.gitlab.polimi.it/DAER/mbdyn/-/wikis/Development-Guidelines,https://public.gitlab.polimi.it/DAER/mbdyn/-/wikis/GSoc-Project-Ideas
MDAnalysis,Analysis of molecular simulations data with Python,"python, cython, c/c++","science, computational-chemistry, high-performance-computing, molecular-simulation, machine-learning",https://www.mdanalysis.org,"Analysis of molecular simulations data with Python
MDAnalysis is a Python library for the analysis of computer simulations of many-body systems at the molecular scale, spanning use cases from interactions of drugs with proteins to novel materials. It is written by scientists for scientists and is used for cutting edge research in biophysics, chemistry, soft-matter physics, and materials research around the world in academia and national research labs. MDAnalysis strives to be highly interoperable and hence a growing number of projects use MDAnalysis as their foundational library or integrate it. The goal of MDAnalysis is to make it easy for users to analyze data that are produced by simulations (primarily molecular dynamics simulations) that run on some of the largest supercomputers in the world. MDAnalysis accomplishes this goal by providing a toolkit of programming building blocks that provide an abstract Python interface to the simulation data — agnostic of the specific simulation package that produced it — that lends itself to interactive data exploration and rapid prototyping but is also a robust foundational library that can form the basis for new computational tools. MDAnalysis allows one to read particle-based trajectories such as the ones produced by MD simulations or individual coordinate frames (such as biomolecules in the Protein Databank format) and access the atomic coordinates through NumPy arrays. Together with a powerful selection language and many implemented analysis algorithms, MDAnalysis provides a flexible and fast framework for complex analysis tasks. Welcoming documentation such as the User Guide https://userguide.mdanalysis.org/ make it easy to get started. New releases are downloaded a few thousand times and the academic papers describing MDAnalysis are cited more than almost two thousand times, indicating the widespread use in the academic community.",https://github.com/MDAnalysis/mdanalysis/wiki/Google-Summer-Of-Code,https://github.com/MDAnalysis/mdanalysis/wiki/GSoC-2025-Project-Ideas
Meshery,"the extensible, collaborative, Kubernetes manager","javascript, golang, kubernetes, visual design","collaboration, devops, Platform Engineering, cloud native infrastructure, infrastructure as design",https://meshery.io,"the extensible, collaborative, Kubernetes manager
As a self-service engineering platform, Meshery enables collaborative design and operation of cloud and cloud native infrastructure. Meshery is for all cloud and cloud native infrastructure. Kubernetes-centric. Kubernetes not required. Infrastructure diversity is a reality for any enterprise. Whether you’re running a single Kubernetes cluster or multiple Kubernetes clusters, on one cloud or multiple clouds, you’ll find that Meshery supports your infrastructure diversity (or lack thereof). Meshery is for engineering teams. Whether you are a Platform Engineer, Site Reliability Engineer, DevOps Engineer, Developer, or Operator, Meshery provides a platform for you to collaborate on the design and operation of your cloud native infrastructure. Whether making a Day 0 adoption choice, a Day 1 configuration and provisioning, or maintaining a Day 2 deployment, Meshery has useful capabilities in either circumstance. Targeted audience for Meshery project would be any technology operators that leverage Cloud and cloud native infrastructure. Meshery is like Google Docs for DevOps. Using Meshery extensions you can freely collaborate across projects and team with multi-player infrastructure design and operation. Meshery enables cloud native best practices with design patterns and the Meshery Catalog. Through Models, Meshery describes infrastructure under management, enabling you to define cloud native designs and patterns and then to export those designs and share within the Meshery Catalog.",https://docs.meshery.io/project/contributing,https://meshery.io/programs/gsoc/2025
MetaBrainz Foundation Inc,"Open music / book metadata, music recommendations","python, machine learning, perl, postgres, spark","machine learning, open data, music, books, music social network",https://metabrainz.org,"Open music / book metadata, music recommendations
The MetaBrainz Foundation is a non-profit that believes in free, open access to data. It has been set up to build community maintained databases and make them available in the public domain or under Creative Commons licenses. Our data is mostly gathered by volunteers and verified by peer review to ensure it is consistent and correct. All non-commercial use of this data is free, but commercial users are asked to support us in order to help fund the project. We encourage all data users to contribute to the data gathering process so that our data can be as comprehensive as possible. With this data we are building a music social network and bias free music recommendations.",https://wiki.musicbrainz.org/Development/Summer_of_Code/2025,https://wiki.musicbrainz.org/Development/Summer_of_Code/2025
Micro Electronics Research Lab UITU,Accelerating Engineering Innovation,"RISCV, Processor, Hardware, systemonchip, memory","iot, embedded, Processor, System on Chip, RISC-V",https://www.merledupk.org,"Accelerating Engineering Innovation
A non-profit organization fostering research on IoT, AI and ML based architectures leveraging the open-source RISC-V ISA. The main purpose of this Lab is to train undergraduate students for future Silicon industry.",https://github.com/merledu/Google-Summer-of-Code/wiki/GSoC-Proposal-Template,https://github.com/merledu/Google-Summer-of-Code/wiki/GSoC'25-Project-Ideas-List
MIT App Inventor,Anyone can build apps with global impact,"javascript, java, gwt, swift","education, development tools, android, ios",http://appinventor.mit.edu,"Anyone can build apps with global impact
MIT App Inventor is a free, open source web app that anyone can use to build mobile apps. It has been used by over 8 million people worldwide who have built more than 30 million apps. It is available in twelve different languages and used by people from ages 13 and up.",https://github.com/mit-cml/appinventor-sources/wiki/Google-Summer-of-Code-2025,https://github.com/mit-cml/appinventor-sources/wiki/Google-Summer-of-Code-2025
,,,,,,,
Mixxx ,DJ Mixing App With Powerful Features For All DJs,"javascript, c++, qt, pytorch, onnx","music, dj, streaming",https://mixxx.org,"DJ Mixing App With Powerful Features For All DJs
Mixxx is a feature rich DJ mixing application. It supports many MIDI and HID DJ controllers, runs on Win Linux and MacOs. It supports effects, harmonic mixing and beatmatching. Mixxx has an unusually broad community for an open-source project, encompassing performing musicians, C++ addicts, amateur DJs, Internet radio broadcasters, and casual users.",https://github.com/mixxxdj/mixxx/wiki/Gsocadvice,https://github.com/mixxxdj/mixxx/wiki/GSOC-2025-Ideas
National Resource for Network Biology,Developing open source tools for network biology,"python, javascript, json, html, css","machine learning, web application, data science, scientific computing, network biology",https://nrnb.org/gsoc.html,"Developing open source tools for network biology
The National Resource for Network Biology (NRNB, https://www.nrnb.org) organizes the development of free, open-source software technologies to enable network-based visualization, analysis, and biomedical discovery. Biomedical research is increasingly dependent on knowledge expressed in terms of networks, including gene, protein and drug interactions, cell-cell and viral-host communication, and vast social networks. Our technologies enable researchers to assemble and analyze these networks and to use them to better understand biological systems and, in particular, how they fail in disease. The NRNB mentoring organization includes projects such as Cytoscape (https://cytoscape.org/), WikiPathways (https://wikipathways.org/), SBML (https://sbml.org/), and SBGN (https://sbgn.github.io/). This is a great opportunity to work at the intersection of biology and computing! For example, Cytoscape is downloaded over 20,000 times per month by researchers. We take mentoring seriously and are proud of our 96% success rate (https://www.nrnb.org/alumni.html#gsoc-tab) with former students and projects. But don’t take our word for it, read testimonials from prior NRNB students (https://www.nrnb.org/testimonials.html#student-tab) and mentors (https://www.nrnb.org/testimonials.html#mentor-tab)",https://docs.google.com/document/d/1Zi6L38CHEeq2aL6xzv0Ozhd_Y6D71W3yCBGHplmxr6k/edit?usp=sharing,https://github.com/nrnb/GoogleSummerOfCode/issues
Neovim,hyperextensible Vim-based text editor,"c, lua","ai, editor, text-editor",https://neovim.io/,"hyperextensible Vim-based text editor
Neovim is a fork of the Vim text editor, designed for extensibility and usability.",https://github.com/neovim/neovim/wiki/Google-Summer-of-Code,https://github.com/neovim/neovim/wiki/Google-Summer-of-Code#gsoc-ideas-2025
Neuroinformatics Unit,Open-source tools for neuroscience and ML,"python, numpy, pytorch, Scipy, naparipython, c++, r, julia","visualization, neuroscience, data-science, Computer-Vision, neuroanatomy",https://neuroinformatics.dev,"Open-source tools for neuroscience and ML
The Neuroinformatics Unit is dedicated to the development of high quality, accurate, robust, easy to use and maintainable open-source software for neuroscience and machine learning. We collaborate with researchers and other software engineers to advance neuroscience research and make new algorithms and tools available to the global community.",https://neuroinformatics.dev/get-involved/gsoc/guidelines,https://neuroinformatics.dev/get-involved/gsoc/
NumFOCUS,NumFOCUS promotes open source scientific software.,"python, c++, r, julia","data science, graphics, ai, scientific computing, numerical computation",https://numfocus.org,"NumFOCUS promotes open source scientific software.
NumFOCUS supports and promotes world-class, innovative, open source scientific software. Most individual projects, even the wildly successful ones, find the overhead of a non-profit to be too large for their community to bear. NumFOCUS provides a critical service as an umbrella organization for this projects.",https://github.com/numfocus/gsoc/blob/master/CONTRIBUTING-students.md,https://github.com/numfocus/gsoc/blob/master/2025/ideas-list.md
omegaUp,Open CS Education as a catalyst for social change,"python, mysql, php, typescript, vue.js","education, web, cloud, edtech, UX/UI",https://omegaup.org,"Open CS Education as a catalyst for social change
omegaUp is a non-profit organization (501c3) aimed to increase the number of talented Software Engineers in Latin America. Our open source platform omegaUp.com lets students immerse in a learning environment that fosters self paced learning of computer science skills with a democratic access to state-of-the-art learning tools. Teachers and tutors can create new coding challenges or use existing ones to start online programming competitions with local, national or even international reach, with automated grading of student's coding solutions. The omegaUp.com platform also enables teachers to leverage Competitive Programming tools and concepts inside the classroom to improve their educational experience.",https://github.com/omegaup/omegaup/wiki/Google-Summer-of-Code-2025,https://github.com/omegaup/omegaup/wiki/Google-Summer-of-Code-2025
Open Climate Fix,Using Computers to Fix Climate Change,"python, pytorch","Forecasting, Climate, renewables",https://www.openclimatefix.org,"Using Computers to Fix Climate Change
Open Climate Fix is a non-profit product lab, developing state-of-the-art renewable energy forecasts to decarbonize the electricity grid.",https://docs.google.com/document/d/19vU8JAhr2ekvtKrZNC067seerZxMHNGrvS9nBrXBP24/edit?usp=sharing,https://docs.google.com/document/d/1nh6pdIjCTSLWwgFhgIV1gpG8CbIqGyoCFDHOfWmKdwA/edit?tab=t.0#heading=h.1ins3zbcqjjv
